,Name,Author,User Rating,Reviews,Price,Genre
444,"The Official Sat Study Guide, 2016 Edition (Official Study Guide For The New Sat)",The College Board,4.3,807,36,Non Fiction
445,The Paris Wife: A Novel,Paula McLain,4.3,3759,16,Fiction
446,"The Pioneer Woman Cooks: A Year Of Holidays: 140 Step-By-Step Recipes For Simple, Scrumptious Celebrations",Ree Drummond,4.8,2663,17,Non Fiction
447,"The Pioneer Woman Cooks: Dinnertime - Comfort Classics, Freezer Food, 16-Minute Meals, And Other Delicious Ways To Solve…",Ree Drummond,4.8,3428,14,Non Fiction
448,The Pioneer Woman Cooks: Food From My Frontier,Ree Drummond,4.8,2876,21,Non Fiction
449,"The Plant Paradox Cookbook: 100 Delicious Recipes To Help You Lose Weight, Heal Your Gut, And Live Lectin-Free",Dr. Steven R Gundry MD,4.5,3601,18,Non Fiction
450,"The Plant Paradox: The Hidden Dangers In ""Healthy"" Foods That Cause Disease And Weight Gain",Dr. Steven R Gundry MD,4.4,7058,17,Non Fiction
451,The Pout-Pout Fish,Deborah Diesen,4.8,9784,5,Fiction
453,The Power Of Habit: Why We Do What We Do In Life And Business,Charles Duhigg,4.6,10795,21,Non Fiction
454,The President Is Missing: A Novel,James Patterson,4.3,10191,18,Fiction
455,The Racketeer,John Grisham,4.3,14493,18,Fiction
456,"The Red Pyramid (The Kane Chronicles, Book 1)",Rick Riordan,4.6,2186,12,Fiction
457,"The Road To Serfdom: Text And Documents--The Definitive Edition (The Collected Works Of F. A. Hayek, Volume 2)",F. A. Hayek,4.6,1204,14,Non Fiction
458,"The Serpent'S Shadow (The Kane Chronicles, Book 3)",Rick Riordan,4.8,2091,12,Fiction
459,The Shack: Where Tragedy Confronts Eternity,William P. Young,4.6,19720,8,Fiction
461,The Short Second Life Of Bree Tanner: An Eclipse Novella (The Twilight Saga),Stephenie Meyer,4.6,2122,0,Fiction
462,The Silent Patient,Alex Michaelides,4.5,27536,14,Fiction
463,"The Son Of Neptune (Heroes Of Olympus, Book 2)",Rick Riordan,4.8,4290,10,Fiction
464,The Subtle Art Of Not Giving A F*Ck: A Counterintuitive Approach To Living A Good Life,Mark Manson,4.6,26490,15,Non Fiction
467,The Sun And Her Flowers,Rupi Kaur,4.7,5487,9,Non Fiction
468,"The Third Wheel (Diary Of A Wimpy Kid, Book 7)",Jeff Kinney,4.7,6377,7,Fiction
469,"The Throne Of Fire (The Kane Chronicles, Book 2)",Rick Riordan,4.7,1463,10,Fiction
470,The Time Traveler'S Wife,Audrey Niffenegger,4.4,3759,6,Fiction
471,The Tipping Point: How Little Things Can Make A Big Difference,Malcolm Gladwell,4.4,3503,9,Non Fiction
472,The Total Money Makeover: Classic Edition: A Proven Plan For Financial Fitness,Dave Ramsey,4.7,11550,10,Non Fiction
473,The Twilight Saga Collection,Stephenie Meyer,4.7,3801,82,Fiction
474,"The Ugly Truth (Diary Of A Wimpy Kid, Book 5)",Jeff Kinney,4.8,3796,12,Fiction
475,The Unofficial Harry Potter Cookbook: From Cauldron Cakes To Knickerbocker Glory--More Than 150 Magical Recipes For…,Dinah Bucholz,4.7,9030,10,Non Fiction
476,The Very Hungry Caterpillar,Eric Carle,4.9,19546,5,Fiction
483,The Whole30: The 30-Day Guide To Total Health And Food Freedom,Melissa Hartwig Urban,4.6,7508,16,Non Fiction
486,The Wonderful Things You Will Be,Emily Winfield Martin,4.9,8842,10,Fiction
490,The Wonky Donkey,Craig Smith,4.8,30183,4,Fiction
492,The Wright Brothers,David McCullough,4.7,6169,16,Non Fiction
493,"Things That Matter: Three Decades Of Passions, Pastimes And Politics [Deckled Edge]",Charles Krauthammer,4.7,7034,15,Non Fiction
494,"Thinking, Fast And Slow",Daniel Kahneman,4.6,11034,19,Non Fiction
496,Thirteen Reasons Why,Jay Asher,4.5,7932,9,Fiction
497,Thomas Jefferson: The Art Of Power,Jon Meacham,4.5,1904,23,Non Fiction
498,Three Cups Of Tea: One Man'S Mission To Promote Peace - One School At A Time,Greg Mortenson,4.3,3319,11,Non Fiction
500,Thug Kitchen: The Official Cookbook: Eat Like You Give A F*Ck (Thug Kitchen Cookbooks),Thug Kitchen,4.6,11128,23,Non Fiction
504,Tina Fey: Bossypants,Tina Fey,4.3,5977,12,Non Fiction
509,To Kill A Mockingbird,Harper Lee,4.8,26234,7,Fiction
510,"Tools Of Titans: The Tactics, Routines, And Habits Of Billionaires, Icons, And World-Class Performers",Timothy Ferriss,4.6,4360,21,Non Fiction
511,"Towers Of Midnight (Wheel Of Time, Book Thirteen)",Robert Jordan,4.8,2282,21,Fiction
512,True Compass: A Memoir,Edward M. Kennedy,4.5,438,15,Non Fiction
513,"Twilight (The Twilight Saga, Book 1)",Stephenie Meyer,4.7,11676,9,Fiction
514,Ultimate Sticker Book: Frozen: More Than 60 Reusable Full-Color Stickers,DK,4.5,2586,5,Fiction
518,"Unbroken: A World War Ii Story Of Survival, Resilience, And Redemption",Laura Hillenbrand,4.8,29673,13,Non Fiction
520,Under The Dome: A Novel,Stephen King,4.3,6740,20,Fiction
521,Unfreedom Of The Press,Mark R. Levin,4.9,5956,11,Non Fiction
522,Unicorn Coloring Book: For Kids Ages 4-8 (Us Edition) (Silly Bear Coloring Books),Silly Bear,4.8,6108,4,Non Fiction
523,"Uninvited: Living Loved When You Feel Less Than, Left Out, And Lonely",Lysa TerKeurst,4.7,4585,9,Non Fiction
524,Watchmen,Alan Moore,4.8,3829,42,Fiction
525,Water For Elephants: A Novel,Sara Gruen,4.5,8958,12,Fiction
526,What Happened,Hillary Rodham Clinton,4.6,5492,18,Non Fiction
527,What If?: Serious Scientific Answers To Absurd Hypothetical Questions,Randall Munroe,4.7,9292,17,Non Fiction
528,What Pet Should I Get? (Classic Seuss),Dr. Seuss,4.7,1873,14,Fiction
529,What Should Danny Do? (The Power To Choose Series),Adir Levy,4.8,8170,13,Fiction
530,What To Expect When You'Re Expecting,Heidi Murkoff,4.4,3341,9,Non Fiction
531,"Wheat Belly: Lose The Wheat, Lose The Weight, And Find Your Path Back To Health",William Davis,4.4,7497,6,Non Fiction
533,When Breath Becomes Air,Paul Kalanithi,4.8,13779,14,Non Fiction
534,Where The Crawdads Sing,Delia Owens,4.8,87841,15,Fiction
535,Where The Wild Things Are,Maurice Sendak,4.8,9967,13,Fiction
536,Whose Boat Is This Boat?: Comments That Don'T Help In The Aftermath Of A Hurricane,The Staff of The Late Show with,4.6,6669,12,Non Fiction
537,Wild: From Lost To Found On The Pacific Crest Trail,Cheryl Strayed,4.4,17044,18,Non Fiction
538,Winter Of The World: Book Two Of The Century Trilogy,Ken Follett,4.5,10760,15,Fiction
539,Women Food And God: An Unexpected Path To Almost Everything,Geneen Roth,4.2,1302,11,Non Fiction
540,Wonder,R. J. Palacio,4.8,21625,9,Fiction
545,Wrecking Ball (Diary Of A Wimpy Kid Book 14),Jeff Kinney,4.9,9413,8,Fiction
546,You Are A Badass: How To Stop Doubting Your Greatness And Start Living An Awesome Life,Jen Sincero,4.7,14331,8,Non Fiction
